{
  "schemaVersion": 1,
  "manifestVersion": "1.0.0",
  "claimScope": "contract_fixture",
  "generatedAt": "2026-08-13T18:00:00Z",
  "build": { "product": "Project Ambient", "version": "0.0.0-contract-fixture", "channel": "development", "sourceRevision": "a5b3f41b4155f8bfe8bf859934314746c943cfea" },
  "platform": { "family": "linux", "displayName": "Linux Wayland contract fixture", "versionRange": { "minimum": "vendor-supported", "maximumTested": "not-yet-tested" }, "architectures": ["arm64", "x86_64"], "environment": { "desktop": "GNOME or KDE Plasma", "session": "Wayland", "legacy": "X11 best-effort only" }, "integrationMethods": ["desktop_shell_adapter"], "supportLifecycle": "preview" },
  "releaseBinding": { "mode": "embedded", "assetPath": "capabilities/project-ambient-capabilities.json", "mediaType": "application/vnd.project-ambient.capabilities+json;version=1" },
  "evidenceCatalog": { "contract-issue": { "type": "contract_fixture", "uri": "https://github.com/MeekPhills/project-ambient/issues/20", "summary": "Exercises the Linux contract without claiming that a Linux build exists." } },
  "capabilities": [
    { "id": "wallpaper.static", "state": "unavailable_by_build", "explanation": "The contract reserves static wallpaper support, but no Linux build exists yet.", "evidenceRefs": ["contract-issue"], "stateDetails": { "reasonCode": "build_not_implemented", "plannedMilestone": "M5" } },
    { "id": "wallpaper.live", "state": "unavailable_by_build", "explanation": "The contract reserves supported live behavior, but no Linux build exists yet.", "evidenceRefs": ["contract-issue"], "stateDetails": { "reasonCode": "build_not_implemented", "plannedMilestone": "M5" } },
    { "id": "screen_saver", "state": "unavailable_by_build", "explanation": "Desktop-specific screen-saver integration awaits tested Linux adapters.", "evidenceRefs": ["contract-issue"], "stateDetails": { "reasonCode": "build_not_implemented", "plannedMilestone": "M5" } },
    { "id": "lock_screen", "state": "unavailable_by_build", "explanation": "Desktop-specific lock integration awaits tested Linux adapters.", "evidenceRefs": ["contract-issue"], "stateDetails": { "reasonCode": "build_not_implemented", "plannedMilestone": "M5" } },
    { "id": "displays.independent", "state": "unavailable_by_build", "explanation": "Independent display mapping awaits GNOME and KDE Wayland adapter tests.", "evidenceRefs": ["contract-issue"], "stateDetails": { "reasonCode": "build_not_implemented", "plannedMilestone": "M5" } },
    { "id": "displays.same_source", "state": "unavailable_by_build", "explanation": "Same-source display mapping awaits GNOME and KDE Wayland adapter tests.", "evidenceRefs": ["contract-issue"], "stateDetails": { "reasonCode": "build_not_implemented", "plannedMilestone": "M5" } },
    { "id": "displays.synchronized", "state": "unavailable_by_build", "explanation": "Synchronized playback awaits GNOME and KDE Wayland adapter tests.", "evidenceRefs": ["contract-issue"], "stateDetails": { "reasonCode": "build_not_implemented", "plannedMilestone": "M5" } },
    { "id": "displays.spanned", "state": "unavailable_by_build", "explanation": "Spanned panorama behavior awaits desktop topology adapter tests.", "evidenceRefs": ["contract-issue"], "stateDetails": { "reasonCode": "build_not_implemented", "plannedMilestone": "M5" } },
    { "id": "overlays", "state": "unavailable_by_build", "explanation": "Overlay rendering awaits tested Linux compositor integration.", "evidenceRefs": ["contract-issue"], "stateDetails": { "reasonCode": "build_not_implemented", "plannedMilestone": "M5" } },
    { "id": "solar.rules", "state": "unavailable_by_build", "explanation": "Solar scheduling is portable policy work, but no Linux build exists yet.", "evidenceRefs": ["contract-issue"], "stateDetails": { "reasonCode": "build_not_implemented", "plannedMilestone": "M5" } },
    { "id": "lifecycle.lock", "state": "unavailable_by_build", "explanation": "Lock-event policy awaits tested desktop session adapters.", "evidenceRefs": ["contract-issue"], "stateDetails": { "reasonCode": "build_not_implemented", "plannedMilestone": "M5" } },
    { "id": "lifecycle.login_logout", "state": "unavailable_by_build", "explanation": "Login and logout policy awaits tested desktop session adapters.", "evidenceRefs": ["contract-issue"], "stateDetails": { "reasonCode": "build_not_implemented", "plannedMilestone": "M5" } },
    { "id": "lifecycle.power", "state": "unavailable_by_build", "explanation": "Power-event policy awaits tested system integration.", "evidenceRefs": ["contract-issue"], "stateDetails": { "reasonCode": "build_not_implemented", "plannedMilestone": "M5" } },
    { "id": "lifecycle.camera", "state": "unavailable_by_build", "explanation": "Camera-aware policy awaits explicit desktop and privacy integration.", "evidenceRefs": ["contract-issue"], "stateDetails": { "reasonCode": "build_not_implemented", "plannedMilestone": "M5" } },
    { "id": "lifecycle.occlusion", "state": "unavailable_by_build", "explanation": "Occlusion policy awaits compositor-specific evidence and tests.", "evidenceRefs": ["contract-issue"], "stateDetails": { "reasonCode": "build_not_implemented", "plannedMilestone": "M5" } },
    { "id": "secure_storage", "state": "unavailable_by_build", "explanation": "Secret-service integration awaits a tested Linux build.", "evidenceRefs": ["contract-issue"], "stateDetails": { "reasonCode": "build_not_implemented", "plannedMilestone": "M5" } },
    { "id": "package.install", "state": "unavailable_by_build", "explanation": "Linux packages are not available until the supported desktop targets pass tests.", "evidenceRefs": ["contract-issue"], "stateDetails": { "reasonCode": "build_not_implemented", "plannedMilestone": "M5" } },
    { "id": "package.update", "state": "unavailable_by_build", "explanation": "Signed Linux update channels are not available until packages exist.", "evidenceRefs": ["contract-issue"], "stateDetails": { "reasonCode": "build_not_implemented", "plannedMilestone": "M8" } },
    { "id": "remote.control", "state": "unavailable_by_build", "explanation": "Remote policy control awaits a real Linux device adapter.", "evidenceRefs": ["contract-issue"], "stateDetails": { "reasonCode": "build_not_implemented", "plannedMilestone": "M5" } },
    { "id": "mobile.wallpaper_action", "state": "unavailable_by_build", "explanation": "This desktop target does not ship the mobile companion action surface.", "evidenceRefs": ["contract-issue"], "stateDetails": { "reasonCode": "build_platform_target_excludes_mobile", "plannedMilestone": "M6" } }
  ]
}
