{
  "schemaVersion": 1,
  "manifestVersion": "1.0.0",
  "claimScope": "contract_fixture",
  "generatedAt": "2026-08-13T18:00:00Z",
  "build": { "product": "Project Ambient", "version": "0.0.0-contract-fixture", "channel": "development", "sourceRevision": "a5b3f41b4155f8bfe8bf859934314746c943cfea" },
  "platform": { "family": "android", "displayName": "Android companion contract fixture", "versionRange": { "minimum": "API 26", "maximumTested": "not-yet-tested" }, "architectures": ["arm64", "x86_64"], "environment": { "role": "companion and OS-permitted wallpaper service" }, "integrationMethods": ["wallpaper_service", "remote_companion"], "supportLifecycle": "preview" },
  "releaseBinding": { "mode": "embedded", "assetPath": "capabilities/project-ambient-capabilities.json", "mediaType": "application/vnd.project-ambient.capabilities+json;version=1" },
  "evidenceCatalog": {
    "contract-issue": { "type": "contract_fixture", "uri": "https://github.com/MeekPhills/project-ambient/issues/20", "summary": "Exercises the Android contract without claiming that an Android build exists." },
    "wallpaper-service-doc": { "type": "platform_documentation", "uri": "https://developer.android.com/reference/android/service/wallpaper/WallpaperService", "summary": "Android documents the WallpaperService surface for app-provided live wallpaper engines." }
  },
  "capabilities": [
    { "id": "wallpaper.static", "state": "unavailable_by_build", "explanation": "The Android platform can expose wallpaper actions, but Project Ambient has no Android build yet.", "evidenceRefs": ["contract-issue"], "stateDetails": { "reasonCode": "build_not_implemented", "plannedMilestone": "M6" } },
    { "id": "wallpaper.live", "state": "unavailable_by_build", "explanation": "Android exposes WallpaperService, but Project Ambient has not implemented or tested an Android engine.", "evidenceRefs": ["contract-issue", "wallpaper-service-doc"], "stateDetails": { "reasonCode": "build_not_implemented", "plannedMilestone": "M6" } },
    { "id": "screen_saver", "state": "unavailable_by_os", "explanation": "The mobile target does not claim a desktop-style screen-saver extension.", "evidenceRefs": ["contract-issue"], "stateDetails": { "reasonCode": "os_no_desktop_screen_saver_surface", "osConstraint": "The target is a mobile companion rather than a desktop screen-saver host." } },
    { "id": "lock_screen", "state": "unavailable_by_build", "explanation": "Lock-screen-specific behavior requires device checks and a tested Android build.", "evidenceRefs": ["contract-issue"], "stateDetails": { "reasonCode": "build_not_implemented", "plannedMilestone": "M6" } },
    { "id": "displays.independent", "state": "unavailable_by_os", "explanation": "Desktop multi-display wallpaper mapping does not apply to this mobile companion target.", "evidenceRefs": ["contract-issue"], "stateDetails": { "reasonCode": "os_mobile_target_has_no_desktop_topology", "osConstraint": "The companion has no managed desktop display topology." } },
    { "id": "displays.same_source", "state": "unavailable_by_os", "explanation": "Desktop same-source display mapping does not apply to this mobile companion target.", "evidenceRefs": ["contract-issue"], "stateDetails": { "reasonCode": "os_mobile_target_has_no_desktop_topology", "osConstraint": "The companion has no managed desktop display topology." } },
    { "id": "displays.synchronized", "state": "unavailable_by_os", "explanation": "Desktop synchronized-display playback does not apply to this mobile companion target.", "evidenceRefs": ["contract-issue"], "stateDetails": { "reasonCode": "os_mobile_target_has_no_desktop_topology", "osConstraint": "The companion has no managed desktop display topology." } },
    { "id": "displays.spanned", "state": "unavailable_by_os", "explanation": "Desktop spanned-panorama behavior does not apply to this mobile companion target.", "evidenceRefs": ["contract-issue"], "stateDetails": { "reasonCode": "os_mobile_target_has_no_desktop_topology", "osConstraint": "The companion has no managed desktop display topology." } },
    { "id": "overlays", "state": "unavailable_by_build", "explanation": "OS-permitted mobile surfaces require a real build before support can be claimed.", "evidenceRefs": ["contract-issue"], "stateDetails": { "reasonCode": "build_not_implemented", "plannedMilestone": "M6" } },
    { "id": "solar.rules", "state": "unavailable_by_build", "explanation": "Solar rule editing is planned for the companion, but no Android build exists yet.", "evidenceRefs": ["contract-issue"], "stateDetails": { "reasonCode": "build_not_implemented", "plannedMilestone": "M6" } },
    { "id": "lifecycle.lock", "state": "unavailable_by_build", "explanation": "Lock-event control requires a real OS-permitted Android implementation.", "evidenceRefs": ["contract-issue"], "stateDetails": { "reasonCode": "build_not_implemented", "plannedMilestone": "M6" } },
    { "id": "lifecycle.login_logout", "state": "unavailable_by_os", "explanation": "Desktop login and logout lifecycle policy does not apply directly to this mobile companion target.", "evidenceRefs": ["contract-issue"], "stateDetails": { "reasonCode": "os_no_desktop_session_lifecycle", "osConstraint": "The companion does not own a desktop login session." } },
    { "id": "lifecycle.power", "state": "unavailable_by_build", "explanation": "Power-aware companion defaults require a tested Android build before support can be claimed.", "evidenceRefs": ["contract-issue"], "stateDetails": { "reasonCode": "build_not_implemented", "plannedMilestone": "M6" } },
    { "id": "lifecycle.camera", "state": "unavailable_by_build", "explanation": "Camera-aware policy requires a privacy-reviewed Android build before support can be claimed.", "evidenceRefs": ["contract-issue"], "stateDetails": { "reasonCode": "build_not_implemented", "plannedMilestone": "M6" } },
    { "id": "lifecycle.occlusion", "state": "unavailable_by_os", "explanation": "Desktop window-occlusion policy does not apply directly to this mobile companion target.", "evidenceRefs": ["contract-issue"], "stateDetails": { "reasonCode": "os_no_desktop_window_occlusion_surface", "osConstraint": "The companion does not observe desktop window topology." } },
    { "id": "secure_storage", "state": "unavailable_by_build", "explanation": "Keystore-backed pairing storage requires a tested Android build before support can be claimed.", "evidenceRefs": ["contract-issue"], "stateDetails": { "reasonCode": "build_not_implemented", "plannedMilestone": "M6" } },
    { "id": "package.install", "state": "unavailable_by_build", "explanation": "No signed Android package exists, so installation support is not claimed.", "evidenceRefs": ["contract-issue"], "stateDetails": { "reasonCode": "build_not_implemented", "plannedMilestone": "M6" } },
    { "id": "package.update", "state": "unavailable_by_build", "explanation": "No Android release channel exists, so update support is not claimed.", "evidenceRefs": ["contract-issue"], "stateDetails": { "reasonCode": "build_not_implemented", "plannedMilestone": "M8" } },
    { "id": "remote.control", "state": "unavailable_by_build", "explanation": "Pairing and idempotent remote actions require the M6 protocol and a tested Android build.", "evidenceRefs": ["contract-issue"], "stateDetails": { "reasonCode": "build_not_implemented", "plannedMilestone": "M6" } },
    { "id": "mobile.wallpaper_action", "state": "unavailable_by_build", "explanation": "Wallpaper actions require a real build and device capability checks before support can be claimed.", "evidenceRefs": ["contract-issue", "wallpaper-service-doc"], "stateDetails": { "reasonCode": "build_not_implemented", "plannedMilestone": "M6" } }
  ]
}
