{
  "schemaVersion": 1,
  "manifestVersion": "1.0.0",
  "claimScope": "contract_fixture",
  "generatedAt": "2026-08-13T18:00:00Z",
  "build": { "product": "Project Ambient", "version": "0.0.0-contract-fixture", "channel": "development", "sourceRevision": "a5b3f41b4155f8bfe8bf859934314746c943cfea" },
  "platform": { "family": "windows", "displayName": "Windows contract fixture", "versionRange": { "minimum": "10.0.19045", "maximumTested": "not-yet-tested" }, "architectures": ["arm64", "x86_64"], "environment": { "shell": "Explorer" }, "integrationMethods": ["desktop_shell_adapter"], "supportLifecycle": "preview" },
  "releaseBinding": { "mode": "embedded", "assetPath": "capabilities/project-ambient-capabilities.json", "mediaType": "application/vnd.project-ambient.capabilities+json;version=1" },
  "evidenceCatalog": { "contract-issue": { "type": "contract_fixture", "uri": "https://github.com/MeekPhills/project-ambient/issues/20", "summary": "Exercises the Windows contract without claiming that a Windows build exists." } },
  "capabilities": [
    { "id": "wallpaper.static", "state": "unavailable_by_build", "explanation": "The contract reserves static wallpaper support, but no Windows build exists yet.", "evidenceRefs": ["contract-issue"], "stateDetails": { "reasonCode": "build_not_implemented", "plannedMilestone": "M5" } },
    { "id": "wallpaper.live", "state": "unavailable_by_build", "explanation": "The contract reserves live wallpaper support, but no Windows build exists yet.", "evidenceRefs": ["contract-issue"], "stateDetails": { "reasonCode": "build_not_implemented", "plannedMilestone": "M5" } },
    { "id": "screen_saver", "state": "unavailable_by_build", "explanation": "The contract reserves screen-saver integration, but no Windows build exists yet.", "evidenceRefs": ["contract-issue"], "stateDetails": { "reasonCode": "build_not_implemented", "plannedMilestone": "M5" } },
    { "id": "lock_screen", "state": "unavailable_by_build", "explanation": "The contract reserves exact lock behavior, but no Windows build exists yet.", "evidenceRefs": ["contract-issue"], "stateDetails": { "reasonCode": "build_not_implemented", "plannedMilestone": "M5" } },
    { "id": "displays.independent", "state": "unavailable_by_build", "explanation": "Independent display mapping is planned, but no Windows build exists yet.", "evidenceRefs": ["contract-issue"], "stateDetails": { "reasonCode": "build_not_implemented", "plannedMilestone": "M5" } },
    { "id": "displays.same_source", "state": "unavailable_by_build", "explanation": "Same-source display mapping is planned, but no Windows build exists yet.", "evidenceRefs": ["contract-issue"], "stateDetails": { "reasonCode": "build_not_implemented", "plannedMilestone": "M5" } },
    { "id": "displays.synchronized", "state": "unavailable_by_build", "explanation": "Synchronized display playback is planned, but no Windows build exists yet.", "evidenceRefs": ["contract-issue"], "stateDetails": { "reasonCode": "build_not_implemented", "plannedMilestone": "M5" } },
    { "id": "displays.spanned", "state": "unavailable_by_build", "explanation": "Spanned panorama behavior is planned, but no Windows build exists yet.", "evidenceRefs": ["contract-issue"], "stateDetails": { "reasonCode": "build_not_implemented", "plannedMilestone": "M5" } },
    { "id": "overlays", "state": "unavailable_by_build", "explanation": "Overlay rendering is planned, but no Windows build exists yet.", "evidenceRefs": ["contract-issue"], "stateDetails": { "reasonCode": "build_not_implemented", "plannedMilestone": "M5" } },
    { "id": "solar.rules", "state": "unavailable_by_build", "explanation": "Solar scheduling is planned, but no Windows build exists yet.", "evidenceRefs": ["contract-issue"], "stateDetails": { "reasonCode": "build_not_implemented", "plannedMilestone": "M5" } },
    { "id": "lifecycle.lock", "state": "unavailable_by_build", "explanation": "Lock-event policy is planned, but no Windows build exists yet.", "evidenceRefs": ["contract-issue"], "stateDetails": { "reasonCode": "build_not_implemented", "plannedMilestone": "M5" } },
    { "id": "lifecycle.login_logout", "state": "unavailable_by_build", "explanation": "Session policy is planned, but no Windows build exists yet.", "evidenceRefs": ["contract-issue"], "stateDetails": { "reasonCode": "build_not_implemented", "plannedMilestone": "M5" } },
    { "id": "lifecycle.power", "state": "unavailable_by_build", "explanation": "Power-event policy is planned, but no Windows build exists yet.", "evidenceRefs": ["contract-issue"], "stateDetails": { "reasonCode": "build_not_implemented", "plannedMilestone": "M5" } },
    { "id": "lifecycle.camera", "state": "unavailable_by_build", "explanation": "Camera-aware policy is planned, but no Windows build exists yet.", "evidenceRefs": ["contract-issue"], "stateDetails": { "reasonCode": "build_not_implemented", "plannedMilestone": "M5" } },
    { "id": "lifecycle.occlusion", "state": "unavailable_by_build", "explanation": "Occlusion-aware policy is planned, but no Windows build exists yet.", "evidenceRefs": ["contract-issue"], "stateDetails": { "reasonCode": "build_not_implemented", "plannedMilestone": "M5" } },
    { "id": "secure_storage", "state": "unavailable_by_build", "explanation": "Secure integration storage is planned, but no Windows build exists yet.", "evidenceRefs": ["contract-issue"], "stateDetails": { "reasonCode": "build_not_implemented", "plannedMilestone": "M5" } },
    { "id": "package.install", "state": "unavailable_by_build", "explanation": "A Windows installer is planned, but no Windows build exists yet.", "evidenceRefs": ["contract-issue"], "stateDetails": { "reasonCode": "build_not_implemented", "plannedMilestone": "M5" } },
    { "id": "package.update", "state": "unavailable_by_build", "explanation": "Signed Windows updates are planned, but no Windows build exists yet.", "evidenceRefs": ["contract-issue"], "stateDetails": { "reasonCode": "build_not_implemented", "plannedMilestone": "M5" } },
    { "id": "remote.control", "state": "unavailable_by_build", "explanation": "Remote policy control is planned, but no Windows build exists yet.", "evidenceRefs": ["contract-issue"], "stateDetails": { "reasonCode": "build_not_implemented", "plannedMilestone": "M5" } },
    { "id": "mobile.wallpaper_action", "state": "unavailable_by_build", "explanation": "This desktop target does not ship the mobile companion action surface.", "evidenceRefs": ["contract-issue"], "stateDetails": { "reasonCode": "build_platform_target_excludes_mobile", "plannedMilestone": "M6" } }
  ]
}
