{
  "schemaVersion": 1,
  "manifestVersion": "1.0.0",
  "claimScope": "contract_fixture",
  "generatedAt": "2026-08-13T18:00:00Z",
  "build": { "product": "Project Ambient", "version": "0.0.0-contract-fixture", "channel": "development", "sourceRevision": "a5b3f41b4155f8bfe8bf859934314746c943cfea" },
  "platform": { "family": "ios_ipados", "displayName": "iOS and iPadOS companion contract fixture", "versionRange": { "minimum": "current-vendor-supported", "maximumTested": "not-yet-tested" }, "architectures": ["arm64"], "environment": { "role": "companion", "formFactor": "phone or tablet" }, "integrationMethods": ["app_intents", "remote_companion"], "supportLifecycle": "preview" },
  "releaseBinding": { "mode": "embedded", "assetPath": "capabilities/project-ambient-capabilities.json", "mediaType": "application/vnd.project-ambient.capabilities+json;version=1" },
  "evidenceCatalog": {
    "contract-issue": { "type": "contract_fixture", "uri": "https://github.com/MeekPhills/project-ambient/issues/20", "summary": "Exercises the mobile limitation contract without claiming that an iOS build exists." },
    "managed-wallpaper-doc": { "type": "platform_documentation", "uri": "https://developer.apple.com/documentation/devicemanagement/settingscommand/command-data.dictionary/settings-data.dictionary/wallpaper-data.dictionary", "summary": "Apple documents a managed-device static wallpaper setting with explicit Lock and Home destinations." }
  },
  "capabilities": [
    { "id": "wallpaper.static", "state": "unavailable_by_build", "explanation": "A consumer companion build does not exist, so no static wallpaper action is claimed.", "evidenceRefs": ["contract-issue", "managed-wallpaper-doc"], "stateDetails": { "reasonCode": "build_not_implemented", "plannedMilestone": "M6" } },
    { "id": "wallpaper.live", "state": "unavailable_by_os", "explanation": "The companion contract does not claim a continuously running third-party wallpaper renderer on iOS or iPadOS.", "evidenceRefs": ["contract-issue"], "stateDetails": { "reasonCode": "os_no_declared_continuous_wallpaper_surface", "osConstraint": "No approved continuous third-party wallpaper surface is declared for this contract target." } },
    { "id": "screen_saver", "state": "unavailable_by_os", "explanation": "The companion contract does not claim a desktop-style screen-saver extension on iOS or iPadOS.", "evidenceRefs": ["contract-issue"], "stateDetails": { "reasonCode": "os_no_desktop_screen_saver_surface", "osConstraint": "The target is a mobile companion rather than a desktop screen-saver host." } },
    { "id": "lock_screen", "state": "unavailable_by_build", "explanation": "Lock-screen actions require an OS-permitted implementation and a real mobile build before support can be claimed.", "evidenceRefs": ["contract-issue", "managed-wallpaper-doc"], "stateDetails": { "reasonCode": "build_not_implemented", "plannedMilestone": "M6" } },
    { "id": "displays.independent", "state": "unavailable_by_os", "explanation": "Desktop multi-display wallpaper mapping does not apply to this mobile companion target.", "evidenceRefs": ["contract-issue"], "stateDetails": { "reasonCode": "os_mobile_target_has_no_desktop_topology", "osConstraint": "The companion has no managed desktop display topology." } },
    { "id": "displays.same_source", "state": "unavailable_by_os", "explanation": "Desktop same-source display mapping does not apply to this mobile companion target.", "evidenceRefs": ["contract-issue"], "stateDetails": { "reasonCode": "os_mobile_target_has_no_desktop_topology", "osConstraint": "The companion has no managed desktop display topology." } },
    { "id": "displays.synchronized", "state": "unavailable_by_os", "explanation": "Desktop synchronized-display playback does not apply to this mobile companion target.", "evidenceRefs": ["contract-issue"], "stateDetails": { "reasonCode": "os_mobile_target_has_no_desktop_topology", "osConstraint": "The companion has no managed desktop display topology." } },
    { "id": "displays.spanned", "state": "unavailable_by_os", "explanation": "Desktop spanned-panorama behavior does not apply to this mobile companion target.", "evidenceRefs": ["contract-issue"], "stateDetails": { "reasonCode": "os_mobile_target_has_no_desktop_topology", "osConstraint": "The companion has no managed desktop display topology." } },
    { "id": "overlays", "state": "unavailable_by_build", "explanation": "Widgets and OS-permitted companion surfaces require a real build before support can be claimed.", "evidenceRefs": ["contract-issue"], "stateDetails": { "reasonCode": "build_not_implemented", "plannedMilestone": "M6" } },
    { "id": "solar.rules", "state": "unavailable_by_build", "explanation": "Solar rule editing is planned for the companion, but no mobile build exists yet.", "evidenceRefs": ["contract-issue"], "stateDetails": { "reasonCode": "build_not_implemented", "plannedMilestone": "M6" } },
    { "id": "lifecycle.lock", "state": "unavailable_by_build", "explanation": "Lock-event control requires a real OS-permitted companion implementation.", "evidenceRefs": ["contract-issue"], "stateDetails": { "reasonCode": "build_not_implemented", "plannedMilestone": "M6" } },
    { "id": "lifecycle.login_logout", "state": "unavailable_by_os", "explanation": "Desktop login and logout lifecycle policy does not apply directly to this mobile companion target.", "evidenceRefs": ["contract-issue"], "stateDetails": { "reasonCode": "os_no_desktop_session_lifecycle", "osConstraint": "The companion does not own a desktop login session." } },
    { "id": "lifecycle.power", "state": "unavailable_by_build", "explanation": "Power-aware companion behavior requires a tested mobile build before support can be claimed.", "evidenceRefs": ["contract-issue"], "stateDetails": { "reasonCode": "build_not_implemented", "plannedMilestone": "M6" } },
    { "id": "lifecycle.camera", "state": "unavailable_by_build", "explanation": "Camera-aware policy requires a privacy-reviewed mobile build before support can be claimed.", "evidenceRefs": ["contract-issue"], "stateDetails": { "reasonCode": "build_not_implemented", "plannedMilestone": "M6" } },
    { "id": "lifecycle.occlusion", "state": "unavailable_by_os", "explanation": "Desktop window-occlusion policy does not apply directly to this mobile companion target.", "evidenceRefs": ["contract-issue"], "stateDetails": { "reasonCode": "os_no_desktop_window_occlusion_surface", "osConstraint": "The companion does not observe desktop window topology." } },
    { "id": "secure_storage", "state": "unavailable_by_build", "explanation": "Keychain-backed pairing storage requires a tested mobile build before support can be claimed.", "evidenceRefs": ["contract-issue"], "stateDetails": { "reasonCode": "build_not_implemented", "plannedMilestone": "M6" } },
    { "id": "package.install", "state": "unavailable_by_build", "explanation": "No signed mobile package exists, so installation support is not claimed.", "evidenceRefs": ["contract-issue"], "stateDetails": { "reasonCode": "build_not_implemented", "plannedMilestone": "M6" } },
    { "id": "package.update", "state": "unavailable_by_build", "explanation": "No mobile release channel exists, so update support is not claimed.", "evidenceRefs": ["contract-issue"], "stateDetails": { "reasonCode": "build_not_implemented", "plannedMilestone": "M8" } },
    { "id": "remote.control", "state": "unavailable_by_build", "explanation": "Pairing and idempotent remote actions require the M6 protocol and a tested mobile build.", "evidenceRefs": ["contract-issue"], "stateDetails": { "reasonCode": "build_not_implemented", "plannedMilestone": "M6" } },
    { "id": "mobile.wallpaper_action", "state": "unavailable_by_build", "explanation": "Exact OS-permitted wallpaper actions require a real build and limitation matrix before support can be claimed.", "evidenceRefs": ["contract-issue", "managed-wallpaper-doc"], "stateDetails": { "reasonCode": "build_not_implemented", "plannedMilestone": "M6" } }
  ]
}
